title,url,content
Ether Jumps 7% as Bitcoin Traders Watch $80K Support Ahead of FOMC,https://www.coindesk.com/markets/2025/03/19/ether-zooms-7-as-bitcoin-traders-watch-usd80k-support-ahead-of-fomc,"Ether (ETH) zoomed nearly 7% in the past 24 hours to lead gains among majors as traders await the results of the Federal Open Market Committee (FOMC) meeting on Wednesday. ETH’s gains were coupled with a 4% gain in memecoin dogecoin (DOGE), which historically tends to act correlated to the asset’s movements. Other Ethereum-based memecoins pepe (PEPE) and mog (MOG), rose more than 5% — continuing to act as levered bets. Elsewhere, majors XRP, BNB Chain’s BNB, Solana’s SOL and Cardano’s ADA rose 3%. Tron’s TRX dipped after a surge 5% earlier in the day as memecoin trading picked up on the blockchain following a no-fee update in the Sunpump platform. Bitcoin (BTC) rose 2% and remained steady under $84,000 in Asian evening hours ahead of the FOMC, where traders expect rates to be held steady. The $80,000 mark remains one to be watched, some say, as a break below would mean a critical support level vanishes. The widely-watched ETH/BTC ratio - or the trading pair of ether against bitcoin - rose from 0.23 to 0.24 since Asian morning hours, indicative of a bump in demand for riskier ETH versus the perceived safety of bitcoin. Ether rose on no immediate catalyst, but the mothership network has technical catalysts in the making. The Pectra upgrade, Ethereum's next major update, is currently in testing and aims to improve scalability, staking, and user experience with over 20 EIPs, including EIP-7702 (smart account functionality) and EIP-7251 (raising validator staking limits to 2,048 ETH). Testing began on Holesky in February 2025, followed by Sepolia in March, but faced challenges like transaction processing issues due to client incompatibilities. A new testnet, Hooli, launched on March 17, with Pectra testing scheduled for March 26. If successful, mainnet deployment is expected in late April or early May 2025. “BTC has found some support at the $80K, but that seems tenuous at best amid broader macro weakness,” traders at Singapore-based QCP Capital said in a broadcast message. “We won’t attempt to call the exact moment when the music stops, but in the short term, we struggle to identify meaningful tailwinds to reverse this rout.” “We will be watching closely for any dovish shifts, particularly on growth and inflation expectations. Given that it will take months for the impact of tariffs to ripple through the economy, we expect the Fed to remain in “wait-and-see” mode,” QCP added. Meanwhile, gold broke above $3,000 to new highs earlier Wednesday, leading to some eyeing an inverse correlation of the yellow metal with bitcoin. “Despite its historical correlation with gold as a macro hedge, Bitcoin's current divergence—falling while gold rises—suggests it's acting more like a risk asset, influenced by Fed policy uncertainty, profit-taking, and a shift to traditional safe-havens,” Ryan Lee, Chief Analyst at Bitget Research, told CoinDesk in a Telegram message. “The FOMC outcome could either trigger a recovery if dovish or deepen the correction if hawkish, with bitcoin's short-term trajectory tied to broader economic signals rather than solely reinforcing its ""digital gold"" role,” Lee added. Shaurya is the Co-Leader of the CoinDesk tokens and data team in Asia with a focus on crypto derivatives, DeFi, market microstructure, and protocol analysis.

Shaurya holds over $1,000 in BTC, ETH, SOL, AVAX, SUSHI, CRV, NEAR, YFI, YFII, SHIB, DOGE, USDT, USDC, BNB, MANA, MLN, LINK, XMR, ALGO, VET, CAKE, AAVE, COMP, ROOK, TRX, SNX, RUNE, FTM, ZIL, KSM, ENJ, CKB, JOE, GHST, PERP, BTRFLY, OHM, BANANA, ROME, BURGER, SPIRIT, and ORCA.

He provides over $1,000 to liquidity pools on Compound, Curve, SushiSwap, PancakeSwap, BurgerSwap, Orca, AnySwap, SpiritSwap, Rook Protocol, Yearn Finance, Synthetix, Harvest, Redacted Cartel, OlympusDAO, Rome, Trader Joe, and SUN. About Contact"
"Erdogan Rival's Arrest Sends Lira to Record Low, Bitcoin-TRY Volume Surging on Binance",https://www.coindesk.com/markets/2025/03/19/turkish-lira-crashes-to-record-low-spurring-volume-surge-in-binance-s-bitcoin-lira-pair,"The Turkish lira (TRY) fell to a record low against the dollar following the surprise arrest of President Recep Tayyip Erdogan's rival and Istanbul mayor Ekrem Imamoglu. The currency slumped a record of nearly 41 per U.S. dollar, a 10% slide on the day. The volatility saw a sharp rise in trading volumes in the bitcoin-lira (BTC/TRY) pair on leading cryptocurrency exchange Binance. Imamoglu's Republican People’s Party (CHP) described the arrest as a coup to replace the will of the people. The party was set to hold a primary election next week, with Imamoglu widely expected to emerge as the presidential candidate. On Binance, the BTC/TRY pair saw 93 BTC change hands between 7:00 UTC and 8:00 UTC, according to data source TradingView. That's the highest hourly volume in at least a year. Still, when adjusted for the lira's exchange rate, BTC traded at a massive discount to prices on Coinbase (COIN).  It's possible traders sold BTC/TRY to move money into dollar-linked assets like USDT, the largest stablecoin. CoinDesk reached out to Binance for a comment on the matter. Fiat-currency volatility is not new to Turkey and over the years it has galvanized demand for hard assets like gold and alternative assets like stablecoins and cryptocurrencies. The lira has consistently depreciated since at least 2017, when it 3.53 to the dollar.  Omkar Godbole is a Co-Managing Editor on CoinDesk's Markets team based in Mumbai, holds a masters degree in Finance and a Chartered Market Technician (CMT) member.  Omkar previously worked at FXStreet, writing research on currency markets and as fundamental analyst at currency and commodities desk at Mumbai-based brokerage houses. Omkar holds small amounts of bitcoin, ether, BitTorrent, tron and dot. About Contact"
"Crypto Daybook Americas: Bitcoin ETFs, Frog-Themed Tokens See Renewed Interest",https://www.coindesk.com/daybook-us/2025/03/20/crypto-daybook-americas-bitcoin-etfs-frog-themed-tokens-see-renewed-interest,"You are viewing Crypto Daybook Americas, your new morning briefing on what happened in the crypto markets overnight and what's expected during the coming day. Crypto Daybook Americas will arrive in your inbox at 7 a.m. ET to kickstart your morning with comprehensive insights. If you're not already subscribed, click here. You won't want to start your day without it. By Omkar Godbole (All times ET unless indicated otherwise) Bitcoin (BTC), ether (ETH) and the broader crypto market are facing renewed pressure, reversing some of gains made after Federal Reserve Chairman Jerome Powell downplayed concerns about tariff-driven inflation . President Donald Trump is reportedly scheduled to speak at Blockworks' Digital Asset Summit in New York later, with traders keen to hear how the administration plans to acquire BTC in a budget-neutral manner. Don't get too excited, the likelihood of such an announcement remains low. Trump is more likely to reiterate his aspiration to make America the ""crypto capital of the world,"" and even this may overwhelm markets. On a more positive note, renewed interest in U.S.-listed spot ETFs supports market strength. On Wednesday, bitcoin ETFs experienced a total net inflow of $11.8 million, a fourth consecutive day of positive flows, according to Farside Investors. In contrast, ether spot ETFs recorded a net outflow of $11.7 million, extending a streak of withdrawals to 11 straight days. ""Several catalysts continue to support a bullish outlook,"" Blockhead Research Network said. ""The U.S. government exploring budget-neutral ways to accumulate bitcoin could be a game-changing factor for this cycle. Additionally, solana futures being added to the CME is a major bullish indicator for altcoins, potentially increasing institutional exposure to SOL.""  Speaking of on-chain flows, data from IntoTheBlock reveals that whales now hold some 62,000 more BTC than they did at the beginning of the month, indicating a resurgence in accumulation following nearly a year of declining balances. XRP whales have also been buying over the past two months. For its part, the SUI token has remained resilient, looking to build on its Wednesday gains in the wake of Canary Capital Group, an institutional crypto trading and management firm, filing for a Sui exchange-traded fund (ETF) with the SEC. In wider market news, a domain claim page for Hyperlane, an open interoperability framework, surfaced, sparking speculation of a potential token airdrop on social media. Traditional markets offered mixed cues, with dollar-yen staring at a death cross pattern, teasing a major surge ahead in the Japanese currency, which is seen as an anti-risk holding. Meanwhile, copper neared a record high in a positive sign for risky assets. Stay alert!  By Shaurya Malwa Spot BTC ETFs: Spot ETH ETFs Source: Farside Investors  Omkar Godbole is a Co-Managing Editor on CoinDesk's Markets team based in Mumbai, holds a masters degree in Finance and a Chartered Market Technician (CMT) member.  Omkar previously worked at FXStreet, writing research on currency markets and as fundamental analyst at currency and commodities desk at Mumbai-based brokerage houses. Omkar holds small amounts of bitcoin, ether, BitTorrent, tron and dot. Shaurya is the Co-Leader of the CoinDesk tokens and data team in Asia with a focus on crypto derivatives, DeFi, market microstructure, and protocol analysis.

Shaurya holds over $1,000 in BTC, ETH, SOL, AVAX, SUSHI, CRV, NEAR, YFI, YFII, SHIB, DOGE, USDT, USDC, BNB, MANA, MLN, LINK, XMR, ALGO, VET, CAKE, AAVE, COMP, ROOK, TRX, SNX, RUNE, FTM, ZIL, KSM, ENJ, CKB, JOE, GHST, PERP, BTRFLY, OHM, BANANA, ROME, BURGER, SPIRIT, and ORCA.

He provides over $1,000 to liquidity pools on Compound, Curve, SushiSwap, PancakeSwap, BurgerSwap, Orca, AnySwap, SpiritSwap, Rook Protocol, Yearn Finance, Synthetix, Harvest, Redacted Cartel, OlympusDAO, Rome, Trader Joe, and SUN. About Contact"
"Gold Surges, Bitcoin Rallies, Stocks Down Since Trump's Electoral Win—What’s Driving the Chaos?",https://www.coindesk.com/markets/2025/03/20/gold-surges-bitcoin-rallies-stocks-down-since-trump-s-electoral-win-what-s-driving-the-chaos,"Pro-crypto Donald Trump won the U.S. presidential election over four months ago, and since then, the period has been characterized by financial market turbulence and global uncertainties surrounding tariffs, geopolitical tensions, and ongoing conflicts in the Middle East and between Ukraine and Russia. Bitcoin (BTC) has surged over 23% since the Nov. 5 election, reaching an all-time high of over $109K at the end of January. Despite a subsequent 30% decline from its peak, it remains one of the best-performing assets. Strategy (MSTR), often considered a bitcoin proxy, has gained 34%, recovering well under the Trump administration despite previously dropping around 60% from its November highs. Ethereum's ether token (ETH) has fallen by as much as 18%, alongside disappointing action in the broader crypto market. The Valkyrie Bitcoin Mining ETF has also struggled, dropping almost 30%. Meanwhile, investors have rotated money into BTC, pushing its dominance rate higher by 2% to over 61.  European equities have done well, outshining their U.S. counterparts. The German DAX index is up 20%, and the UK’s FTSE 100 has gained 6%, alongside weaker performances in the U.S. stock market, where the Nasdaq and S&P 500 are both down approximately 2%. A recent report from Bank of America highlights a record drop in U.S. stock allocations. Gold, benefiting from uncertainty, has continued to set new all-time highs, surpassing $3,030—an 11% increase. The U.S. Dollar Index (DXY), which measures the dollar's strength against a basket of major currencies, remains flat. However, under Trump, the dollar has weakened significantly, providing some relief to risk assets and major currencies such as the Euro and the Great British Pound. Meanwhile, the U.S. 10-year Treasury yield has slightly declined to 4.2%, a key metric the administration is closely monitoring. Oil prices have plummeted by around 7% as the U.S. maintains its stance on energy dominance to reduce energy costs.  Notably, some of the so-called ""Magnificent 7"" stocks have struggled, with NVIDIA (NVDA) down 16% and Tesla (TSLA) declining 6%. Recent losses on Wall Street and in the crypto market have ignited hopes for the ""Trump put,"" or potential policy support. However, the administration appears willing to endure short-term pain for long-term benefits, believing that this approach will cleanse the markets of the fiscal spending excesses of the Biden era.  This reset is expected to be characterized lower inflation, improved energy security, and a lower 10-year Treasury yield. ""Scott Bessent’s talk of a “detox period” suggests a controlled downturn might be ahead. If that’s the case, Trump’s playbook seems clear: blame the recession on Biden, use tariffs and crypto narratives to manage costs, and push for lower interest rates to fuel tech and AI growth. Short-term pain, long-term gain—that’s the strategy,"" Gracy Chen, CEO of Bitget, said in an email to CoinDesk this week.  ""Regardless, I don't see BTC falling below 70k, possibly 73-78k which is a solid time to enter for any buyers on the fence. In the next 1-2 years, BTC at 200k isn’t as far-fetched as most would think,"" Chen added.  James Van Straten is a Senior Analyst at CoinDesk, specializing in Bitcoin and its interplay with the macroeconomic environment. Previously, James worked as a Research Analyst at Saidler & Co., a Swiss hedge fund, where he developed expertise in on-chain analytics. His work focuses on monitoring flows to analyze Bitcoin's role within the broader financial system.

In addition to his professional endeavors, James serves as an advisor to Coinsilium, a UK publicly traded company, where he provides guidance on their Bitcoin treasury strategy. He also holds investments in Bitcoin, MicroStrategy (MSTR), and Semler Scientific (SMLR). Omkar Godbole is a Co-Managing Editor on CoinDesk's Markets team based in Mumbai, holds a masters degree in Finance and a Chartered Market Technician (CMT) member.  Omkar previously worked at FXStreet, writing research on currency markets and as fundamental analyst at currency and commodities desk at Mumbai-based brokerage houses. Omkar holds small amounts of bitcoin, ether, BitTorrent, tron and dot. About Contact"
